{
  "format": "chirality.pec.receiving-record",
  "formatVersion": "0.1",
  "record_id": "pr:EUD1-P3",
  "question_id": "Q1",
  "simulated": true,
  "simulated_terms": [
    "PEC response elements constructed from PEC-ORI-003/004/007 and DEL-04-03 CLM-003/019 (FX-EUD1)",
    "release identities and the adoption account are constructed; no PEC release or App adoption exists"
  ],
  "input": {
    "kind": "response",
    "ref": "FX-EUD1 pec/P3.json",
    "sha256": "813039111b1b13fbb667db6218037fd003b7c7fa971a72845296511c2b35e8b6",
    "fixture_standing": "constructed"
  },
  "adoption": {
    "account_ref": "pec/ADOPTION_ACCOUNT.json (constructed OUT-004 account)",
    "release_adopted": true,
    "feeds_adopted": [
      "work_graphs"
    ]
  },
  "recorder": {
    "kind": "tool",
    "identity": "O-D prototype eud1.py (EU-D1)"
  },
  "release": {
    "identity": "pec-release-EX-1",
    "stated_qualification": "qualified"
  },
  "stamp": {
    "examined_through": "e4a0c2c4c369c9f85c3be4417e5815a4b4cb0abc",
    "generated_at": "2026-10-04T08:00:00Z",
    "feed_freshness": [
      {
        "feed": "work_graphs",
        "freshness": "examined through e4a0c2c4c3"
      }
    ]
  },
  "envelope_elements": {
    "pin": "e4a0c2c4c369c9f85c3be4417e5815a4b4cb0abc",
    "feeds": [
      {
        "feed": "work_graphs",
        "coverage": "orientation: work-graph nodes in READY, ACTIVE or BLOCKED for the loop (PEC-ORI-001); deltas: node state changes since the caller's SHA (PEC-ORI-002)",
        "freshness": "examined through e4a0c2c4c3",
        "limitation": null
      }
    ],
    "fallback_signal": "clear"
  },
  "response_standing": {
    "connector": "pec",
    "envelope": "adopted",
    "condition": "stale",
    "supports_reliance": false,
    "reasons": [
      {
        "facet": "envelope",
        "value": "adopted",
        "basis": "release pec-release-EX-1 and feed work_graphs are adopted in the OUT-004 account"
      },
      {
        "facet": "condition",
        "value": "stale",
        "basis": "the cited file projects/chirality-app-v4/execution/_Coordination/WorkGraphs/APP-V4-DESIGN-PASS-4-20261003/WORK_GRAPH.md has different content at the pin e4a0c2c4c3 than at the asked revision e086dfff32"
      }
    ]
  },
  "claims": [
    {
      "claim_id": "c1",
      "statement": "Work-graph nodes READY or ACTIVE at e4a0c2c4c3: VC ACTIVE, E ACTIVE, O-B1 READY, O-C1 READY",
      "citation": {
        "path": "projects/chirality-app-v4/execution/_Coordination/WorkGraphs/APP-V4-DESIGN-PASS-4-20261003/WORK_GRAPH.md",
        "anchor": "#nodes",
        "sha": "e4a0c2c4c369c9f85c3be4417e5815a4b4cb0abc"
      },
      "stated_tier": "record",
      "standing": {
        "connector": "pec",
        "envelope": "adopted",
        "condition": "stale",
        "claim_tier": "record",
        "supports_reliance": false,
        "reasons": [
          {
            "facet": "envelope",
            "value": "adopted",
            "basis": "response envelope"
          },
          {
            "facet": "claim_tier",
            "value": "record",
            "basis": "stated tier 'record'"
          },
          {
            "facet": "condition",
            "value": "stale",
            "basis": "response condition"
          }
        ]
      }
    },
    {
      "claim_id": "c8",
      "statement": "A session for owner O-A was active",
      "citation": {
        "path": "pec-presence:session/O-A"
      },
      "stated_tier": "presence",
      "standing": {
        "connector": "pec",
        "envelope": "adopted",
        "condition": "stale",
        "claim_tier": "presence_advisory",
        "supports_reliance": false,
        "reasons": [
          {
            "facet": "envelope",
            "value": "adopted",
            "basis": "response envelope"
          },
          {
            "facet": "claim_tier",
            "value": "presence_advisory",
            "basis": "stated tier 'presence'"
          },
          {
            "facet": "condition",
            "value": "stale",
            "basis": "response condition"
          }
        ]
      },
      "heartbeat_age_s": 120
    }
  ],
  "conclusions": {
    "supported": [
      {
        "statement": "(a) answered from the route account (ra:EUD1-Q1 f-a)",
        "basis": "source_route",
        "refs": [
          "ra:EUD1-Q1#f-a"
        ]
      },
      {
        "statement": "(b) answered from the route account (ra:EUD1-Q1 f-b): PEC orientation covers READY/ACTIVE/BLOCKED nodes only, so other open nodes are outside its coverage",
        "basis": "source_route",
        "refs": [
          "ra:EUD1-Q1#f-b"
        ]
      },
      {
        "statement": "(c) answered from the route account (ra:EUD1-Q1 f-c)",
        "basis": "source_route",
        "refs": [
          "ra:EUD1-Q1#f-c"
        ]
      }
    ],
    "unsupported": [
      {
        "conclusion": "No work remains in the undertaking",
        "why": "no connector state or its absence establishes empty work; the route shows T2 open"
      },
      {
        "conclusion": "Any item is ready to start, complete or permitted because of this connector material",
        "why": "CS-R2: absence or limitation implies none of these, and a relied record-tier claim only reports what its cited record states at its pin"
      },
      {
        "conclusion": "Owner O-A is working on this undertaking, or any work state is correct because a session was active",
        "why": "claim c8 is a presence fact, advisory at its stated heartbeat age (120 s); presence is never correctness"
      },
      {
        "conclusion": "The node states these claims report (for example VC or E ACTIVE, O-B1 or O-C1 READY) hold now",
        "why": "the pin precedes a change to the cited work graph; the claims describe the earlier revision"
      }
    ],
    "prohibited": [
      "no_work",
      "ready",
      "permitted",
      "correct_by_presence"
    ]
  },
  "route": {
    "needed": true,
    "account_ref": "ra:EUD1-Q1"
  }
}
